{"schema_version":"cognitive-runtime.instance-cutover-plan/v2","plan_id":"cutover-synthetic","instance_id":"instance-synthetic","target_source_revision":"revision-synthetic","publication_prerequisites":{"remote_base_check":true,"push_before_sync":true},"remove_retrieval_paths":["30_RAG"],"disable_mechanisms":["active-memory"],"preserve_independent_paths":["public-author-corpus"],"bootstrap_targets":["USER.md","MEMORY.md"],"public_corpus_adapter":"public-corpus-synthetic","checksum":"sha256:0000000000000000000000000000000000000000000000000000000000000000"}
